{"schemaVersion":"1.0.0","id":"emmetrope-right-fem","provenance":{"source":"eyebiomech fem","citation":"Elastic corneoscleral FEM (no remodeling; spec \u00a77). Approximations: the document's geometry is taken as stress-free and the result is the change from the IOP-only state; fixed optic-nerve support; muscle forces from length-proxy activation x capacity, torque-balanced, with the net force taken by an orbital reaction on the posterior hemisphere; dead loads in the reference configuration; lens follows the scleral spur and the retina the posterior pole. Materials, thickness, eyelid, and force data are unverified (see data/materials, data/eyelid, data/eom). Tests the hypothesis that muscle and lid loading shape the cornea; not an established result.","generatedBy":"eyebiomech fem --eye ../data/fixtures/emmetrope-right.eye.json --gaze 0,0 --iop 15 --out ../data/results/fem/emmetrope-right-primary-15mmHg.eye.json","gitHash":"","date":"2026-10-28","verified":false},"frame":"right eye, origin at the globe center (taken as the center of rotation, an approximation), x temporal, y superior, z posterior (toward the retina), mm","elastic":true,"apexZMm":-12.955338603005682,"loads":[{"kind":"iop","pressureMmHg":15.0},{"kind":"insertion","muscle":"lateralRectus","forceN":0.1823019556171995,"pullDir":[-0.7066638143777741,0.0,0.7075494706725848],"insertionDir":[0.47599166578629015,0.0,0.8794497905520205],"centerMm":[10.553397486624247,0.0,-5.71189998943548],"footprintWidthMm":9.2,"footprintLengthMm":1.0,"tendon":{"stiffnessNPerMm":36.11,"slackLengthMm":7.5,"elongationMm":0.005048517186851274},"tangentPointMm":[8.490593648071016,0.0,8.479965772533289],"tableForceN":0.115914603},{"kind":"insertion","muscle":"medialRectus","forceN":0.07846002983534563,"pullDir":[-0.09177190084694947,-3.454129956081466e-17,0.9957800551401588],"insertionDir":[-0.5751258290000228,1.7653632510852187e-17,0.8180649612451548],"centerMm":[-9.816779534941858,1.2022087635401789e-15,-6.901509948000271],"footprintWidthMm":10.3,"footprintLengthMm":1.0,"tendon":{"stiffnessNPerMm":81.95,"slackLengthMm":3.7,"elongationMm":0.0009574134208095867},"tangentPointMm":[-11.949360661681904,1.1482060005772824e-15,-1.1012628101633926],"tableForceN":0.146707484},{"kind":"insertion","muscle":"superiorRectus","forceN":0.13545729097742276,"pullDir":[-0.34056065858714246,-0.33331000713672104,0.8791603249494433],"insertionDir":[-0.45824351909355565,0.3700609748790596,0.8081260743722567],"centerMm":[6.680733327737977e-16,10.91046550301583,-4.996172785993448],"footprintWidthMm":10.0,"footprintLengthMm":1.0,"tendon":{"stiffnessNPerMm":49.07,"slackLengthMm":6.0,"elongationMm":0.002760490951241548},"tangentPointMm":[-3.6792391507493822,11.079738027025574,2.7753566480862273],"tableForceN":0.1313110435},{"kind":"insertion","muscle":"inferiorRectus","forceN":0.1275108728975817,"pullDir":[-0.3251132890037426,0.329536221252465,0.886401279441662],"insertionDir":[-0.47725793730543786,-0.44380779635413503,0.758458635110871],"centerMm":[-1.9025819285196223e-15,-10.357173621239333,-6.060441780885625],"footprintWidthMm":10.0,"footprintLengthMm":1.0,"tendon":{"stiffnessNPerMm":49.07,"slackLengthMm":6.0,"elongationMm":0.0025985504971995457},"tangentPointMm":[-4.1927335089326,-10.954291571556587,2.5346561676878445],"tableForceN":0.1313110435},{"kind":"insertion","muscle":"superiorOblique","forceN":0.11492483640095051,"pullDir":[-0.7302783077244966,0.3420201344736169,-0.5913677543472374],"insertionDir":[-0.6397488761413832,0.5391394025997366,-0.5477682722102808],"centerMm":[5.794866977692336,10.037004028466228,3.11095915167712],"footprintWidthMm":10.32,"footprintLengthMm":1.0,"tendon":{"stiffnessNPerMm":15.19,"slackLengthMm":20.0,"elongationMm":0.007565822014545788},"tangentPointMm":[3.9649063861689213,11.21397865107131,1.5894024544569447],"tableForceN":0.115914603},{"kind":"insertion","muscle":"inferiorOblique","forceN":0.11841839427149987,"pullDir":[-0.7302783169315761,-0.34202015657781554,-0.5913677301933806],"insertionDir":[-0.2759514008619156,-0.8286451270401115,-0.48702985308400143],"centerMm":[9.777919109756823,-5.645284230132495,4.064857173883199],"footprintWidthMm":9.4,"footprintLengthMm":1.0,"tendon":{"stiffnessNPerMm":276.74,"slackLengthMm":1.0,"elongationMm":0.0004279048719791135},"tangentPointMm":[5.4568359790990595,-10.67250805311868,-0.5661386343705326],"tableForceN":0.115914603},{"kind":"eyelid","upperKPa":1.066578947368421,"lowerKPa":1.066578947368421,"apertureMm":10.1,"upperHeightMm":0.6,"lowerHeightMm":0.6},{"kind":"ciliary","tensionNPerMmPerD":0.001,"accommodationD":0.0,"arcFromLimbusMm":1.5},{"kind":"orbitalSupport","region":"outer surface, z > 0"}],"vertices":[[-6.92820323,-6.92820323,6.92820323],[-7.339053285,-6.023005376,7.339053285],[-7.672059237,-5.126306091,7.672059237],[-7.937274996,-4.242561875,7.937274996],[-8.143180135,-3.373015653,8.143180135],[-8.296566755,-2.516736011,8.296566755],[-8.402574087,-1.671375904,8.402574087],[-8.464777942,-0.833707859,8.464777942],[-8.485281374,0.0,8.485281374],[-8.464777942,0.833707859,8.464777942],[-8.402574087,1.671375904,8.402574087],[-8.296566755,2.516736011,8.296566755],[-8.143180135,3.373015653,8.143180135],[-7.937274996,4.242561875,7.937274996],[-7.672059237,5.126306091,7.672059237],[-7.339053285,6.023005376,7.339053285],[-6.92820323,6.92820323,6.92820323],[-6.023005376,-7.339053285,7.339053285],[-6.428288806,-6.428288806,7.832892573],[-6.763771787,-5.506914362,8.241679769],[-7.035797237,-4.582440798,8.573143739],[-7.250134845,-3.659293033,8.83431487],[-7.411678116,-2.739571196,9.031155915],[-7.524292291,-1.823703511,9.168376684],[-7.590751226,-0.910982164,9.24935713],[-7.61271941,0.0,9.27612544],[-7.590751226,0.910982164,9.24935713],[-7.524292291,1.823703511,9.168376684],[-7.411678116,2.739571196,9.031155915],[-7.250134845,3.659293033,8.83431487],[-7.035797237,4.582440798,8.573143739],[-6.763771787,5.506914362,8.241679769],[-6.428288806,6.428288806,7.832892573],[-6.023005376,7.339053285,7.339053285],[-5.126306091,-7.672059237,7.672059237],[-5.506914362,-6.763771787,8.241679769],[-5.827832826,-5.827832826,8.72196819],[-6.092271126,-4.873527191,9.117728075],[-6.303471606,-3.907612847,9.433811931],[-6.464391297,-2.934771557,9.674645268],[-6.577490303,-1.958075421,9.843909892],[-6.644599359,-0.979432563,9.944345691],[-6.666842796,0.0,9.977635348],[-6.644599359,0.979432563,9.944345691],[-6.577490303,1.958075421,9.843909892],[-6.464391297,2.934771557,9.674645268],[-6.303471606,3.907612847,9.433811931],[-6.092271126,4.873527191,9.117728075],[-5.827832826,5.827832826,8.72196819],[-5.506914362,6.763771787,8.241679769],[-5.126306091,7.672059237,7.672059237],[-4.242561875,-7.937274996,7.937274996],[-4.582440798,-7.035797237,8.573143739],[-4.873527191,-6.092271126,9.117728075],[-5.116748064,-5.116748064,9.572762324],[-5.313335532,-4.117511294,9.940551608],[-5.464586528,-3.10127159,10.223522319],[-5.571679177,-2.073438364,10.423878573],[-5.63554086,-1.038429867,10.543355378],[-5.656760842,0.0,10.583055172],[-5.63554086,1.038429867,10.543355378],[-5.571679177,2.073438364,10.423878573],[-5.464586528,3.10127159,10.223522319],[-5.313335532,4.117511294,9.940551608],[-5.116748064,5.116748064,9.572762324],[-4.873527191,6.092271126,9.117728075],[-4.582440798,7.035797237,8.573143739],[-4.242561875,7.937274996,7.937274996],[-3.373015653,-8.143180135,8.143180135],[-3.659293033,-7.250134845,8.83431487],[-3.907612847,-6.303471606,9.433811931],[-4.117511294,-5.313335532,9.940551608],[-4.288880932,-4.288880932,10.354274514],[-4.421830716,-3.238299768,10.675243685],[-4.516568125,-2.168932502,10.903960023],[-4.573306859,-1.08743762,11.040939444],[-4.592201188,0.0,11.08655439],[-4.573306859,1.08743762,11.040939444],[-4.516568125,2.168932502,10.903960023],[-4.421830716,3.238299768,10.675243685],[-4.288880932,4.288880932,10.354274514],[-4.117511294,5.313335532,9.940551608],[-3.907612847,6.303471606,9.433811931],[-3.659293033,7.250134845,8.83431487],[-3.373015653,8.143180135,8.143180135],[-2.516736011,-8.296566755,8.296566755],[-2.739571196,-7.411678116,9.031155915],[-2.934771557,-6.464391297,9.674645268],[-3.10127159,-5.464586528,10.223522319],[-3.238299768,-4.421830716,10.675243685],[-3.345319483,-3.345319483,11.028040402],[-3.421975068,-2.2438787,11.280740003],[-3.468046617,-1.126014546,11.432617544],[-3.483416127,0.0,11.483284029],[-3.468046617,1.126014546,11.432617544],[-3.421975068,2.2438787,11.280740003],[-3.345319483,3.345319483,11.028040402],[-3.238299768,4.421830716,10.675243685],[-3.10127159,5.464586528,10.223522319],[-2.934771557,6.464391297,9.674645268],[-2.739571196,7.411678116,9.031155915],[-2.516736011,8.296566755,8.296566755],[-1.671375904,-8.402574087,8.402574087],[-1.823703511,-7.524292291,9.168376684],[-1.958075421,-6.577490303,9.843909892],[-2.073438364,-5.571679177,10.423878573],[-2.168932502,-4.516568125,10.903960023],[-2.2438787,-3.421975068,11.280740003],[-2.297765447,-2.297765447,11.551646978],[-2.33023698,-1.153816192,11.714892394],[-2.341083864,0.0,11.769423365],[-2.33023698,1.153816192,11.714892394],[-2.297765447,2.297765447,11.551646978],[-2.2438787,3.421975068,11.280740003],[-2.168932502,4.516568125,10.903960023],[-2.073438364,5.571679177,10.423878573],[-1.958075421,6.577490303,9.843909892],[-1.823703511,7.524292291,9.168376684],[-1.671375904,8.402574087,8.402574087],[-0.833707859,-8.464777942,8.464777942],[-0.910982164,-7.590751226,9.24935713],[-0.979432563,-6.644599359,9.944345691],[-1.038429867,-5.63554086,10.543355378],[-1.08743762,-4.573306859,11.040939444],[-1.126014546,-3.468046617,11.432617544],[-1.153816192,-2.33023698,11.714892394],[-1.170595957,-1.170595957,11.885260208],[-1.176205684,0.0,11.94221672],[-1.170595957,1.170595957,11.885260208],[-1.153816192,2.33023698,11.714892394],[-1.126014546,3.468046617,11.432617544],[-1.08743762,4.573306859,11.040939444],[-1.038429867,5.63554086,10.543355378],[-0.979432563,6.644599359,9.944345691],[-0.910982164,7.590751226,9.24935713],[-0.833707859,8.464777942,8.464777942],[0.